{
  "$schema": "https://json-schema.org/draft/2020-12/schema",
  "title": "data/news.json: las noticias",
  "description": "data/news.json: las noticias, la más nueva arriba. VS Code lee este fichero (por el \"$schema\" de arriba del JSON) para autocompletar, explicar cada campo y subrayar lo que está mal; el build y la vista previa lo usan para revisar.",
  "type": "array",
  "items": {
    "type": "object",
    "additionalProperties": false,
    "required": [],
    "properties": {
      "year": {
        "type": "string",
        "description": "\"2026\""
      },
      "title": {
        "description": "El título.",
        "anyOf": [
          {
            "type": "string",
            "description": "El mismo en los tres idiomas."
          },
          {
            "type": "object",
            "additionalProperties": false,
            "description": "Uno por idioma: { \"es\": …, \"en\": …, \"ca\": … }",
            "properties": {
              "es": {
                "type": "string",
                "description": "En castellano."
              },
              "en": {
                "type": "string",
                "description": "En inglés."
              },
              "ca": {
                "type": "string",
                "description": "En catalán."
              }
            }
          },
          {
            "type": "null",
            "description": "Sin título."
          }
        ]
      },
      "description": {
        "description": "El texto. Una línea en blanco (\\n\\n) separa párrafos.",
        "anyOf": [
          {
            "type": "string",
            "description": "El mismo en los tres idiomas."
          },
          {
            "type": "object",
            "additionalProperties": false,
            "description": "Uno por idioma: { \"es\": …, \"en\": …, \"ca\": … }",
            "properties": {
              "es": {
                "type": "string",
                "description": "En castellano."
              },
              "en": {
                "type": "string",
                "description": "En inglés."
              },
              "ca": {
                "type": "string",
                "description": "En catalán."
              }
            }
          }
        ]
      },
      "image": {
        "type": "string",
        "description": "La foto: \"data/_news/076.webp\""
      },
      "images": {
        "type": "array",
        "items": {
          "type": "string"
        },
        "description": "Varias fotos (sale un pase): [\"data/_news/002_1.webp\", \"data/_news/002_2.webp\"]"
      },
      "links": {
        "type": "array",
        "items": {
          "type": "string"
        },
        "description": "Los enlaces, en orden: [\"https://…\"]. Salen como \"↗ link\", \"↗ link 2\"…"
      }
    }
  }
}
