[
  {
    "year": "2024",
    "title": {
      "es": "A Tree - A Reader on Arboreal Kinship",
      "en": "A Tree - A Reader on Arboreal Kinship",
      "ca": "A Tree - A Reader on Arboreal Kinship"
    },
    "description": {
      "es": "Editado por Marjolein van der Loo\n\nPublicado por Onomatopee\n\n128 páginas\n\n16€\n\nCon contribuciones escritas de Joss Allen, Céline Baumann, Bárbara Sánchez Barroso, Jorge Menna Barreto, Renée Bus, Lucy Davis, Amirio Freeman, Manjot Kaur, Marjolein van der Loo, Karen Lofgren, Anne Richter, Jerrold Saija, Oscar Salguero, Jonmar van Vlijmen y Müge Yilmaz.\n\nContribuciones visuales de Gerbrand Burger, Chihiro Geuzenbroek, Femke Habets, Roderick Hietbrink, Ingela Ihrman, Mari Keski-Korsu, Alice Ladenburg, Hira Nabi, Frank Resseler y Sanne Vaassen.",
      "en": "Edited by Marjolein van der Loo\n\nPublished by Onomatopee\n\n128 pages\n\n16€\n\nWith written contributions by Joss Allen, Céline Baumann, Bárbara Sánchez Barroso, Jorge Menna Barreto, Renée Bus, Lucy Davis, Amirio Freeman, Manjot Kaur, Marjolein van der Loo, Karen Lofgren, Anne Richter, Jerrold Saija, Oscar Salguero, Jonmar van Vlijmen and Müge Yilmaz.\n\nVisual contributions by Gerbrand Burger, Chihiro Geuzenbroek, Femke Habets, Roderick Hietbrink, Ingela Ihrman, Mari Keski-Korsu, Alice Ladenburg, Hira Nabi, Frank Resseler and Sanne Vaassen.",
      "ca": "Editat per Marjolein van der Loo\n\nPublicat per Onomatopee\n\n128 pàgines\n\n16€\n\nAmb contribucions escrites de Joss Allen, Céline Baumann, Bárbara Sánchez Barroso, Jorge Menna Barreto, Renée Bus, Lucy Davis, Amirio Freeman, Manjot Kaur, Marjolein van der Loo, Karen Lofgren, Anne Richter, Jerrold Saija, Oscar Salguero, Jonmar van Vlijmen i Müge Yilmaz.\n\nContribucions visuals de Gerbrand Burger, Chihiro Geuzenbroek, Femke Habets, Roderick Hietbrink, Ingela Ihrman, Mari Keski-Korsu, Alice Ladenburg, Hira Nabi, Frank Resseler i Sanne Vaassen."
    },
    "image": "data/_publications/1.webp",
    "links": [
      "https://www.onomatopee.net/exhibition/a-tree/"
    ]
  },
  {
    "year": "2021",
    "title": {
      "es": "Simpoiesis",
      "en": "Simpoiesis",
      "ca": "Simpoiesis"
    },
    "description": {
      "es": "Autoras: Helen Torres, Ariadna Guiteras, Bárbara Sánchez Barroso, Adriana Vila Guevara, Marta Pol Rigau\n\nEditorial: Arbar\n\nAño de publicación: 2023\n\nColecciones: Cicles Accions ARBAR, 9\n\nPaís: España\n\nIdioma: catalán\n\nISBN: 978-84-09-50365-0",
      "en": "Authors: Helen Torres, Ariadna Guiteras, Bárbara Sánchez Barroso, Adriana Vila Guevara, Marta Pol Rigau\n\nPublisher: Arbar\n\nYear of publication: 2023\n\nCollections: Cicles Accions ARBAR, 9\n\nCountry: Spain\n\nLanguage: Catalan\n\nISBN: 978-84-09-50365-0",
      "ca": "Autores: Helen Torres, Ariadna Guiteras, Bárbara Sánchez Barroso, Adriana Vila Guevara, Marta Pol Rigau\n\nEditorial: Arbar\n\nAny de publicació: 2023\n\nCol·leccions: Cicles Accions ARBAR, 9\n\nPaís: Espanya\n\nIdioma: català\n\nISBN: 978-84-09-50365-0"
    },
    "image": "data/_publications/2.webp",
    "links": [
      "https://dialnet.unirioja.es/descarga/libro/976925.pdf"
    ]
  },
  {
    "year": "2021",
    "title": {
      "es": "A Contemporary Journey Into Video Art. On the Fringes of Identity",
      "en": "A Contemporary Journey Into Video Art. On the Fringes of Identity",
      "ca": "A Contemporary Journey Into Video Art. On the Fringes of Identity"
    },
    "description": {
      "es": "Silvana Editoriale, Giacomo Zaza\n\nHan Nefkens Foundation\n\nCatálogo\n\nItalia",
      "en": "Silvana Editoriale, Giacomo Zaza\n\nHan Nefkens Foundation\n\nCatalogue\n\nItaly",
      "ca": "Silvana Editoriale, Giacomo Zaza\n\nHan Nefkens Foundation\n\nCatàleg\n\nItàlia"
    },
    "images": ["data/_publications/3_1.webp", "data/_publications/3_2.webp"],
    "links": [
      "https://en.silvanaeditoriale.it/libro/9788836641871"
    ]
  },
  {
    "year": "2019",
    "title": {
      "es": "das wort ozean ist ca. 20 quadratmillimeter groß (la palabra océano mide unos 20 milímetros cuadrados)",
      "en": "das wort ozean ist ca. 20 quadratmillimeter groß (the word ocean is about 20 square millimeters in size)",
      "ca": "das wort ozean ist ca. 20 quadratmillimeter groß (la paraula oceà fa uns 20 mil·límetres quadrats)"
    },
    "description": {
      "es": "HISK con Wilfried Huet (Gagarin)\n\nPublicación de artista\n\nBélgica",
      "en": "HISK with Wilfried Huet (Gagarin)\n\nArtist publication\n\nBelgium",
      "ca": "HISK amb Wilfried Huet (Gagarin)\n\nPublicació d'artista\n\nBèlgica"
    },
    "images": ["data/_publications/4_1.webp", "data/_publications/4_2.webp", "data/_publications/4_3.webp", "data/_publications/4_4.webp", "data/_publications/4_5.webp", "data/_publications/4_6.webp"],
    "links": [
      "https://hisk.edu/publications/das-wort-ozean-ist-ca-20-quadratmillimeter-gross"
    ]
  },
  {
    "year": "2018",
    "title": {
      "es": "The possibility of an island",
      "en": "The possibility of an island",
      "ca": "The possibility of an island"
    },
    "description": {
      "es": "Fundació Joan Miró\n\nCatálogo\n\nBarcelona",
      "en": "Fundació Joan Miró\n\nCatalogue\n\nBarcelona",
      "ca": "Fundació Joan Miró\n\nCatàleg\n\nBarcelona"
    },
    "image": "data/_publications/5.webp",
    "links": [
      "https://fmirobcn.org/miroshop/en/exhibition-catalogues/867-the-possibility-of-an-island-espai-13.html"
    ]
  },
  {
    "year": "2018",
    "title": {
      "es": "Greenfield. The Archive",
      "en": "Greenfield. The Archive",
      "ca": "Greenfield. The Archive"
    },
    "description": {
      "es": "Meteoro Editions (Pablo Lerma)\n\nPublicación de artista\n\nPaíses Bajos",
      "en": "Meteoro Editions (Pablo Lerma)\n\nArtist publication\n\nThe Netherlands",
      "ca": "Meteoro Editions (Pablo Lerma)\n\nPublicació d'artista\n\nPaïsos Baixos"
    },
    "image": "data/_publications/6.webp",
    "links": [
      "https://meteoroeditions.com/Greenfield-The-Archive-P-Lerma"
    ]
  },
  {
    "year": "2016",
    "title": {
      "es": "Cartas desde el bosque",
      "en": "Letters from the forest",
      "ca": "Cartes des del bosc"
    },
    "description": {
      "es": "BCN Producció\n\nCatálogo individual\n\nBarcelona",
      "en": "BCN Producció\n\nSolo catalogue publication\n\nBarcelona",
      "ca": "BCN Producció\n\nCatàleg individual\n\nBarcelona"
    },
    "image": "data/_publications/7.webp",
    "links": [
      "https://ajuntament.barcelona.cat/barcelonallibres/ca/publicacions/barbara-sanchez-barroso"
    ]
  },
  {
    "year": "2014",
    "title": {
      "es": "Blood",
      "en": "Blood",
      "ca": "Blood"
    },
    "description": {
      "es": "Fanzine",
      "en": "Fanzine",
      "ca": "Fanzín"
    },
    "image": "data/_publications/8.webp",
    "links": [
      "https://issuu.com/barbarawong/docs/_bloodfanzine_2014_entero"
    ]
  },
  {
    "year": "2013",
    "title": {
      "es": "Nenazas",
      "en": "Nenazas",
      "ca": "Nenazas"
    },
    "description": {
      "es": "Fanzine",
      "en": "Fanzine",
      "ca": "Fanzín"
    },
    "image": "data/_publications/9.webp",
    "links": [
      "https://nenazas.tumblr.com/"
    ]
  }
]
